kind,etag,id,snippet.publishedAt,snippet.channelId,snippet.title,snippet.description,snippet.channelTitle,snippet.playlistId,snippet.position,snippet.videoOwnerChannelTitle,snippet.videoOwnerChannelId,snippet.thumbnails.default.url,snippet.thumbnails.default.width,snippet.thumbnails.default.height,snippet.thumbnails.medium.url,snippet.thumbnails.medium.width,snippet.thumbnails.medium.height,snippet.thumbnails.high.url,snippet.thumbnails.high.width,snippet.thumbnails.high.height,snippet.thumbnails.standard.url,snippet.thumbnails.standard.width,snippet.thumbnails.standard.height,snippet.resourceId.kind,snippet.resourceId.videoId,contentDetails.videoId,contentDetails.videoPublishedAt,status.privacyStatus
youtube#playlistItem,XtLo-kPbN2NZ5-L8sN0vwXZ-PZA,UEx6Z200MjZLZ3ZyaUlOT1VwZ3JCalRaWEhJRFpYT096MC45NDk1REZENzhEMzU5MDQz,2023-03-06T16:49:11Z,UCpPm7MPoB8uOFSN-6xeCaLw,Introduction to SARS-CoV-2 Variant Detection,"Welcome to the SARS-CoV-2 variant detection activity! This is a short overview of the theory and skills you will learn.

Check out the activity! https://jhudatascience.org/GDSCN_Book_SARS_Galaxy_on_AnVIL/

AnVIL Help: https://help.anvilproject.org/

Use the slides from this video: https://docs.google.com/presentation/d/1OgXNEXPKhiNQvl9B6Zd1oZqICae_vVTZvDG6DEEO1tk/edit?usp=sharing",Genomic Data Science Community Network,PLzgm426KgvriINOUpgrBjTZXHIDZXOOz0,0,Genomic Data Science Community Network,UCpPm7MPoB8uOFSN-6xeCaLw,https://i.ytimg.com/vi/OFGa6x2bGHs/default.jpg,120,90,https://i.ytimg.com/vi/OFGa6x2bGHs/mqdefault.jpg,320,180,https://i.ytimg.com/vi/OFGa6x2bGHs/hqdefault.jpg,480,360,https://i.ytimg.com/vi/OFGa6x2bGHs/sddefault.jpg,640,480,youtube#video,OFGa6x2bGHs,OFGa6x2bGHs,2023-03-06T16:52:44Z,public
youtube#playlistItem,o4ExCaN2v7LDIHz04egP52RGo9Q,UEx6Z200MjZLZ3ZyaUlOT1VwZ3JCalRaWEhJRFpYT096MC4xMkVGQjNCMUM1N0RFNEUx,2023-03-02T14:21:24Z,UCpPm7MPoB8uOFSN-6xeCaLw,What is a variant?,"In this video, we’ll talk about genetic variants. 

Genetic variants are small changes in the DNA somewhere inside the genome. These variants create a lot of the diversity we see in the natural world, such as different eye and skin colors or susceptibility to disease.

Knowing about genetic variants helps us understand and interpret genomic sequencing results. In other words, we can better understand the bioinformatics and data science of the genome.

Check out the activity! https://jhudatascience.org/GDSCN_Book_SARS_Galaxy_on_AnVIL/",Genomic Data Science Community Network,PLzgm426KgvriINOUpgrBjTZXHIDZXOOz0,1,Genomic Data Science Community Network,UCpPm7MPoB8uOFSN-6xeCaLw,https://i.ytimg.com/vi/kELyrelihP8/default.jpg,120,90,https://i.ytimg.com/vi/kELyrelihP8/mqdefault.jpg,320,180,https://i.ytimg.com/vi/kELyrelihP8/hqdefault.jpg,480,360,https://i.ytimg.com/vi/kELyrelihP8/sddefault.jpg,640,480,youtube#video,kELyrelihP8,kELyrelihP8,2023-03-02T14:39:42Z,public
youtube#playlistItem,P6E6q528GrY-qg0U-ZfVlo5dxqo,UEx6Z200MjZLZ3ZyaUlOT1VwZ3JCalRaWEhJRFpYT096MC41MzJCQjBCNDIyRkJDN0VD,2023-03-02T14:41:00Z,UCpPm7MPoB8uOFSN-6xeCaLw,The sequencing revolution,"In this video, we’ll talk about the sequencing revolution that has made wide-scale genetic variant detection possible. 

Knowing about this technology will help us understand and interpret genomic sequencing results. Remember that detecting variants means finding slightly different versions of an organism that are genetically different from others.

Check out the activity! https://jhudatascience.org/GDSCN_Book_SARS_Galaxy_on_AnVIL/",Genomic Data Science Community Network,PLzgm426KgvriINOUpgrBjTZXHIDZXOOz0,2,Genomic Data Science Community Network,UCpPm7MPoB8uOFSN-6xeCaLw,https://i.ytimg.com/vi/tXLTHqNT6Jg/default.jpg,120,90,https://i.ytimg.com/vi/tXLTHqNT6Jg/mqdefault.jpg,320,180,https://i.ytimg.com/vi/tXLTHqNT6Jg/hqdefault.jpg,480,360,https://i.ytimg.com/vi/tXLTHqNT6Jg/sddefault.jpg,640,480,youtube#video,tXLTHqNT6Jg,tXLTHqNT6Jg,2023-03-02T14:44:59Z,public
youtube#playlistItem,nBPclHhTo-uBikrpbHYvqQBK5K4,UEx6Z200MjZLZ3ZyaUlOT1VwZ3JCalRaWEhJRFpYT096MC4wMTcyMDhGQUE4NTIzM0Y5,2022-04-21T18:05:34Z,UCpPm7MPoB8uOFSN-6xeCaLw,Alignments & data structure,"In this video, we talk about some of the technical tools that have made wide-scale genetic variant detection possible. 

These tools have broad application, from tracking the delta variant of coronavirus, to locating the genes responsible for hair or eye color. Knowing about the software and data structures helps us understand and interpret genomic sequencing results.",Genomic Data Science Community Network,PLzgm426KgvriINOUpgrBjTZXHIDZXOOz0,3,Genomic Data Science Community Network,UCpPm7MPoB8uOFSN-6xeCaLw,https://i.ytimg.com/vi/MEZP_AzlLyg/default.jpg,120,90,https://i.ytimg.com/vi/MEZP_AzlLyg/mqdefault.jpg,320,180,https://i.ytimg.com/vi/MEZP_AzlLyg/hqdefault.jpg,480,360,https://i.ytimg.com/vi/MEZP_AzlLyg/sddefault.jpg,640,480,youtube#video,MEZP_AzlLyg,MEZP_AzlLyg,2022-04-21T18:06:04Z,public
youtube#playlistItem,rfOHDBsdW3Yb_g1rjy45911UIFI,UEx6Z200MjZLZ3ZyaUlOT1VwZ3JCalRaWEhJRFpYT096MC5DQUNERDQ2NkIzRUQxNTY1,2023-03-02T14:45:29Z,UCpPm7MPoB8uOFSN-6xeCaLw,Cloud computing,"In this video, we talk about how cloud computing and genetic variant detection work together. 

Cloud computing is a powerful way to perform cutting-edge data science work, without having to worry about having the right equipment. After learning the basics, anyone with an internet connection can use cloud computing to look for genomic variants.

Check out the activity! https://jhudatascience.org/GDSCN_Book_SARS_Galaxy_on_AnVIL/",Genomic Data Science Community Network,PLzgm426KgvriINOUpgrBjTZXHIDZXOOz0,4,Genomic Data Science Community Network,UCpPm7MPoB8uOFSN-6xeCaLw,https://i.ytimg.com/vi/hreCMUQaA6s/default.jpg,120,90,https://i.ytimg.com/vi/hreCMUQaA6s/mqdefault.jpg,320,180,https://i.ytimg.com/vi/hreCMUQaA6s/hqdefault.jpg,480,360,https://i.ytimg.com/vi/hreCMUQaA6s/sddefault.jpg,640,480,youtube#video,hreCMUQaA6s,hreCMUQaA6s,2023-03-02T14:47:18Z,public
youtube#playlistItem,gP1xHW34-8F1IRj3qfULwqSjqwA,UEx6Z200MjZLZ3ZyaUlOT1VwZ3JCalRaWEhJRFpYT096MC4wOTA3OTZBNzVEMTUzOTMy,2022-04-21T18:17:23Z,UCpPm7MPoB8uOFSN-6xeCaLw,AnVIL laboratory introduction,"In this introduction video, we’ll talk about the details of the bioinformatics and data science behind variant detection. This video walks you through the steps you'll take on AnVIL when doing this activity. 

Our ultimate goal is to see how our coronavirus sample is different from the original coronavirus. We are especially curious if our sample belongs to the delta variant group. We will be using the same techniques used by scientists to detect variants.

To learn more about AnVIL and this activity, check out:
- Activity home: https://jhudatascience.org/GDSCN_Book_SARS_Galaxy_on_AnVIL/
- AnVIL home: https://anvilproject.org/",Genomic Data Science Community Network,PLzgm426KgvriINOUpgrBjTZXHIDZXOOz0,5,Genomic Data Science Community Network,UCpPm7MPoB8uOFSN-6xeCaLw,https://i.ytimg.com/vi/rYakA0oxq9Y/default.jpg,120,90,https://i.ytimg.com/vi/rYakA0oxq9Y/mqdefault.jpg,320,180,https://i.ytimg.com/vi/rYakA0oxq9Y/hqdefault.jpg,480,360,https://i.ytimg.com/vi/rYakA0oxq9Y/sddefault.jpg,640,480,youtube#video,rYakA0oxq9Y,rYakA0oxq9Y,2022-04-21T18:17:43Z,unlisted
youtube#playlistItem,pZkdnGQvDWG3-gLVkqvh_6ERUnk,UEx6Z200MjZLZ3ZyaUlOT1VwZ3JCalRaWEhJRFpYT096MC5GNjNDRDREMDQxOThCMDQ2,2023-03-29T17:16:56Z,UCpPm7MPoB8uOFSN-6xeCaLw,AnVIL laboratory introduction,"In this introduction video, we’ll talk about the details of the bioinformatics and data science behind variant detection. This video walks you through the steps you'll take on AnVIL when doing this activity. 

Our ultimate goal is to see how our coronavirus sample is different from the original coronavirus. We are especially curious if our sample belongs to the delta variant group. We will be using the same techniques used by scientists to detect variants.

To learn more about AnVIL and this activity, check out:
- Activity home: https://jhudatascience.org/GDSCN_Book_SARS_Galaxy_on_AnVIL/
- AnVIL home: https://anvilproject.org/",Genomic Data Science Community Network,PLzgm426KgvriINOUpgrBjTZXHIDZXOOz0,6,Genomic Data Science Community Network,UCpPm7MPoB8uOFSN-6xeCaLw,https://i.ytimg.com/vi/D-bkZRA2TQ4/default.jpg,120,90,https://i.ytimg.com/vi/D-bkZRA2TQ4/mqdefault.jpg,320,180,https://i.ytimg.com/vi/D-bkZRA2TQ4/hqdefault.jpg,480,360,https://i.ytimg.com/vi/D-bkZRA2TQ4/sddefault.jpg,640,480,youtube#video,D-bkZRA2TQ4,D-bkZRA2TQ4,2023-03-29T17:25:31Z,public
